,text,topic
1077,"The annual Yulin Lychee and Dog Meat Festival, which will open this week coinciding with the summer solstice, has drawn domestic and international condemnation from people concerned with animal rights. But one aspect of the festival gets little attention: Why lychees with dog meat?
 There are hints in traditional Chinese medicine, which takes a holistic view of food. Ingredients are seen not just as a sum of carbohydrates, protein, fat and vitamins. They are believed to have yin and yang properties that contribute to the body’s internal balance.
 According to traditional Chinese medicine, some foods, like lamb and onion, have warm energy. Others, like rabbit and asparagus, are said to have cool energy. Both dog meat and lychees are seen as warming.
 To the uninitiated, the logic may seem mysterious. But many Chinese adhere to these principles, and it is not uncommon to hear a friend say he or she is “shanghuole,” or has too much internal fire. In traditional Chinese medicine, excessive internal heat is tied to symptoms like cold sores and dehydration, which can be treated by eating “cooling” foods like cucumber or watermelon.
 In parts of China, dog meat is typically consumed in the winter because it is seen as warming and restorative.
 But in the southern Chinese city of Yulin, some say eating dog meat and drinking lychee liquor on the summer solstice is an old tradition. Lychees are locally grown in the subtropical clime, and the concept of “yire gongre,” or using heat to attack heat, is also prevalent.
 Critics say the festival itself may have been a marketing ploy started around 2009 to increase sales of dog meat and lychees.
",
5068,"BERLIN — The German comic who prompted an international incident with a satirical poem about President Recep Tayyip Erdogan of Turkey will fight the ruling of a Hamburg court that banned repeating most of the text, his lawyer said on Wednesday.
 In a ruling made public late Tuesday, the superior state court in Hamburg said that the comic, Jan Böhmermann, could repeat a few selected lines but not the bulk of the poem, “which, because of its insulting content injuring his honor, Mr. Erdogan does not have to accept.”
 Christian Schertz, a lawyer who is representing Mr. Böhmermann, said the comic rejected the partial injunction imposed by the court because it tried to dissect the poem into permitted and forbidden parts and, in that way, suggested that artistic freedom was somehow divisible.
 Mr. Böhmermann will fight the ruling all the way to the federal constitutional court if need be, Mr. Schertz said in a statement and in a phone interview.
 Mr. Schertz said that the Hamburg court’s ruling failed to take into account the way in which Mr. Böhmermann had framed his poem as deliberate satire, interspersing his reading of it with several remarks noting that the verse was an example of what would be impermissible.
 Mr. Böhmermann read the poem, which contained extremely crude language, on his television show on March 31. By the next day, it had become a litmus test of artistic freedom in Germany, after the public broadcaster ZDF first pulled the show from its digital archive then restored it minus the reading of the poem.
 In what she has since conceded was a mistake, Chancellor Angela Merkel of Germany said through her spokesman on April 4 that she found the poem offensive. Mr. Erdogan went on to sue Mr. Böhmermann for insulting him under an obscure German law that requires the government to give consent in cases of insulting a head of state.
 Ms. Merkel’s coalition government split over how to proceed, with the chancellor eventually giving the go-ahead to Mr. Erdogan but also announcing that the relevant law, which dates from 1871, would be repealed.
 The city-state of Hamburg said this month that it would try to push the repeal through the upper house of Parliament, with the intention of getting the law off the books and thus rendering action against Mr. Böhmermann moot.
 The Turkish leader has also filed a private suit against Mr. Böhmermann that would proceed through the courts under a different law governing such individual action. That suit is currently under scrutiny by state prosecutors in Mainz, which is where ZDF has its headquarters and thus where Mr. Erdogan is pursuing the private suit.
 The Mainz prosecutors said in a brief statement on Wednesday that they did not yet know whether or when their case would proceed.
",
8577,"In New York on Tuesday, Hillary Clinton and Donald J. Trump proved they are front-runners for good reason.
 The state was always going to be friendly turf for them: Mrs. Clinton won two Senate races in New York, and Mr. Trump’s political sensibilities are acutely attuned to the state’s small and dwindling Republican minority.
 But the scale of their victories reflects more than a home-field advantage, and it exposes some important limitations in their opponents’ campaigns. Some of the key takeaways:
 Mrs. Clinton defeated Senator Bernie Sanders of Vermont by crushing him in New York City and its suburbs, easily winning black and Hispanic voters and holding down his margins in friendlier upstate areas. Her political coalition simply looks more like the national Democratic base than his does. In a big state like New York that is more closely reflective of national demographics, that is a decisive advantage.
 Even in upstate cities where Mr. Sanders might have been a more natural fit, like Syracuse and Buffalo, Mrs. Clinton won or fought him to an effective tie.
 It may be that Mrs. Clinton’s position here was unassailable all along: In 2008, she handily defeated Barack Obama in New York’s Democratic primary, taking 57 percent of the vote. On Tuesday, she was on track to beat Mr. Sanders with almost the same level of support.
 Mr. Sanders managed to hold on to the slice of voters who agree most strongly with his message of economic populism. Exit polls show that he won by double digits among voters who said Wall Street mainly hurts the economy and among those who want the next president to be more liberal than Mr. Obama, and that he won by a narrower margin with those who said foreign trade destroys jobs.
 But in as urban and diverse a state as New York, that assemblage of voters goes only so far. Mr. Sanders got wiped out on issues of sharper local resonance: Mrs. Clinton made her more liberal record on gun control a major campaign theme and beat him on the issue by 22 percentage points.
 He needed a big win to reverse nearly a month of setbacks in the delegate race and to quiet stories about disorder in his campaign. And New York delivered: Mr. Trump captured the state by his largest victory margin of the campaign and left Senator Ted Cruz of Texas, his closest rival in the delegate race, in a distant third place.
 If Mr. Trump’s opponents hoped for even scattered signs of voters recoiling from his candidacy, there were none to be seen. He won voters of every age, race and income level, and he prevailed with two groups — college-educated voters and women — who have often rejected him. That adds up to a considerable show of strength for a candidate who still faces a narrow path to clinching the Republican nomination, even after a sweep or near sweep of his home state’s 95 delegates.
 Mr. Cruz appeared to enter the Republican primary in New York with the wind at his back, having beaten Mr. Trump convincingly in Wisconsin and in a string of smaller contests. But he got demolished in New York, coming in third over all and failing to win a single county. He even placed behind Gov. John R. Kasich of Ohio upstate, where Mr. Cruz had once hoped to generate interest among rural conservatives and peel away a few delegates.
 Mr. Cruz plainly paid a price for his derisive comments in the past about “New York values,” and those remarks may have made the state a fool’s errand for him from the start.
 But Mr. Cruz may have a deeper cultural problem: In the Northeastern and mid-Atlantic States that have voted so far, he has performed well only in Maine, where he won a surprise caucus victory. If his brand of religion-inflected Texas conservatism cannot connect with a blue-state Republican audience, next week’s primaries in Connecticut, Delaware, Maryland, Pennsylvania and Rhode Island may be just as painful.
 It has been more than a month since Mr. Kasich won Ohio, his home state and still his only victory. But on Tuesday, he claimed a modest symbolic prize, snatching Mr. Trump’s home borough, Manhattan, from beneath the front-runner’s nose.
 Mr. Kasich, always the softest-edged candidate in the race, has positioned himself in increasingly explicit terms as the standard-bearer for Republican moderates. That is a diminishing group, but it was enough to win him the only county in the state that Mr. Trump lost, and it could help him collect delegates in the blue-state primaries on April 26.
",
4280,"Over the weekend an exhibition opened at the Museum at the Fashion Institute of Technology in New York. Entitled “Uniformity,” it displays 71 pieces from the museum’s collection of (surprise) uniforms, divided into four categories — military, work, school, sports — as well as a select group of the fashion looks they influenced, like Geoffrey Beene’s 1967 sequined football jersey gown and Rei Kawakubo’s 1998 military vest and pleated skirt for Comme des Garçons.
 “I was interested in the inherent dichotomy between uniforms and fashion,” said Emma McClendon, assistant curator of costume, and the organizer of the exhibition, “because while they should be antithetical to one another — the first is about conformity, the second about creativity — they are also deeply interrelated. It’s ironic.”
 But not as ironic as the fact that the show opens just as a number of recent disputes have underscored a somewhat different, and disruptive, reality. We live in a moment in which the notion of a uniform is increasingly out of fashion, at least when it comes to the implicit codes of professional and public life. Indeed, the museum may be the only place they now make sense.
 If once upon a time Melanie Griffith’s character in “Working Girl” could manipulate viewers’ assumptions about her job and background simply by swapping leather jackets and minidresses for greige suits, today it would be impossible. “We are in a very murky period,” Ms. McClendon said.
 Just before the museum’s show opened, for example, Britain was momentarily distracted from discussions over Brexit (leaving the European Union) by the news that Nicola Thorp, a temp worker, had been sent home from her receptionist job at PricewaterhouseCoopers for refusing to wear heels, as dictated by the dress code of her agency, Portico.
 She took her cause public, starting a petition for a parliamentary hearing titled “Make it illegal for a company to require women to wear high heels at work.” If you get more than 100,000 signatures, Parliament will consider the petition, and as of Tuesday afternoon she had 140,712.
 Almost immediately, ITV, the British television network, conducted a poll on whether employers should be allowed to require women to wear heels; social media freaked out; and Portico announced it had changed its policy: Flats were now acceptable for women (men, of course, could always wear them).
 A few days later, sweatergate broke out in the United States when a weather forecaster on KTLA-TV in Los Angeles was handed a gray sweater to cover up a tank dress she was wearing on the air. She said it was a joke, courtesy of her co-anchor, but Twitter took offense, perceiving it as an attempt to control what women wear.
 All of this follows famous dress code brouhahas like the UBS scandal of 2010 when the Internet discovered that the Swiss bank had issued a 44-page booklet of guidelines for employee dress that included instructions on shoulder width and underwear shade.
 Then there was the “flat shoe” uproar of 2015, when two women were supposedly barred from the red carpet in Cannes for not wearing heels. (The festival director denied the report on Twitter.)
 And earlier this year, Kansas State Senator Mitch Holmes was forced to issue a public apology for having included, in his guidelines for the Senate Ethics and Elections Committee, which he chaired, a rule for those appearing before the state panel that read: “Conferees should be dressed in professional attire. For ladies, low-cut necklines and miniskirts are inappropriate.” No such specific guidelines were issued for men. Oops. This did not sit well with many.
 “I have decided to retract the conferee guidelines,” he said later in a statement, which also noted, “My failure to clearly specify that all conferees, regardless of gender, should strive to present themselves professionally is unacceptable.”
 The slippery slope may have started as a gentle incline way back in the 1970s, and become a bit steeper during the Casual Friday movement of the 1990s and the success of the Facebook I.P.O. in 2012 with its hoodie-wearing billionaires. But today, we are speeding down it at breakneck pace, partly thanks to the hot-button conversation around gender equality, and fluidity.
 “There has been a dramatic change very recently,” said Susan Scafidi, a law professor at Fordham University and founder of the Fashion Law Institute.
 She noted that last December the New York City Commission on Human Rights announced new guidelines for the municipal human rights law that expressly prohibited “enforcing dress codes, uniforms, and grooming standards that impose different requirements based on sex or gender.”
 As a result, no employer may require men to wear ties unless they also require women to wear ties, or ask that heels be worn unless both sexes have to wear them. And though this applies only to “official” dress codes, the trickle-down effect is inevitable.
 “Dress is now open to the interpretation of the individual, rather than an institution,” Professor Scafidi said.
 This has created an even greater tension in the more ambiguous areas of office dress, especially as the boundaries between home and work become ever blurrier.
 “There’s a strain of thought that says an employee represents a company, and thus dress is not about personal expression, but company expression,” Professor Scafidi said. “But there’s a counterargument that believes because we identify so much with our careers, we should be able to be ourselves at work.”
 And that has led to all sorts of complications. One person’s “appropriate” can easily be another’s “disgraceful,” and words like “professional,” when used to describe dress requirements, can seem so vague as to be almost meaningless. Kanye West wearing ripped jeans and a jeweled Balmain jacket at the Met Gala: cool or rude? Julia Roberts at the premiere of “Money Monster” at Cannes this year in bare feet: red carpet pioneer or a step too far?
 At The New York Times, Michael Golden, the vice chairman, told me: “We have customer-facing jobs and those that are principally internal. We ask employees to dress appropriately for the interactions planned for their day.” But that can have broad interpretations. In the newsroom, people show up in everything from double-breasted suits to shorts; from sneakers and Birkenstocks to platform heels.
 All of which leaves us where? Confused, mostly. And fast trying to create our own codes, or parse those of the offices around us. Mark Zuckerberg, for example, is on the record as saying he wears the same gray T-shirt every day so that he can focus his energy on other decisions.
 Ms. McClendon acknowledges that she tends to wear “all black, pretty much every day, and sculptural shapes — it’s the museum uniform.” Professor Scafidi said, “My business uniform is a black jacket with a fitted, knee-length sheath, classic 100-millimeter single-sole pumps, and usually our logo pin — my equivalent of armor, arms and insignia, respectively.”
 Indeed, according to Ms. McClendon, uniforms evolved for a reason: “They fulfill a need to identify your place in the world,” for the wearer and the observer. At least when they are easy to read. And part of the idea behind the F.I.T. show, she said, was to “put visitors in the mind-set to consider uniform dressing more broadly, and how it impacts their own lives.”
 In other words, to live an examined life when it comes to your wardrobe and your workplace. Because these issues are only going to get more complicated.
 “We are moving into an era where personal expression is going to trump the desire to create a corporate identity,” Professor Scafidi said. “It’s a huge power shift.” And it has already begun.
",
