,text,topic
8279,"BERLIN — The German government is negotiating with Jewish representatives to ensure that the thousands of poorest and weakest Holocaust survivors worldwide receive the intensive care they need to live out their final years at home.
 The German Finance Ministry and the Conference on Jewish Material Claims Against Germany continue to hold regular talks but the effort to reach an agreement has taken on a new sense of urgency, because the youngest of those needing full-time care are already in their 80s — and many others are over 100 years old.
 With an estimated 100,000 Holocaust victims living in the United States, roughly a fifth of survivors worldwide, their plight has raised concern in Congress, and on Thursday representatives introduced a resolution calling on the German government to do more.
 Representatives Ted Deutch, a Democrat, and Ileana Ros-Lehtinen, a Republican, both from Florida, submitted the resolution to the House asking Germany to “recognize the imperative of immediately and fully funding victims’ medical, mental health, and long-term care needs and to do so with full transparency and accountability to ensure all funds for Holocaust victims.” A companion resolution was introduced in the Senate.
 The German Finance Ministry did not respond to repeated requests for comment.
 The Claims Conference cares for 55,000 survivors in dozens of countries around the world through compensation and reparations programs financed by the German government that began more than 60 years ago.
 But as they age, Holocaust survivors face increasing special-care needs, linked to the persecution they suffered and the isolation resulting from the loss of family members in the Holocaust.
 The current round of talks, which opened in January and is scheduled to end by June, is trying to find a way to meet those needs, said Greg Schneider, the executive vice president of the Claims Conference.
 The German government currently provides compensation for survivors to be cared for in their homes for up to 25 hours per week, based on an assessment of an individual’s need.
 In many cases, however, that is not enough, leaving mentally and physically frail or forgetful survivors without anyone to look after them over the weekend, or throughout the night.
 A central element of the negotiations is to move away from weekly caps on hours and to create a more flexible system.
 German officials have cautioned that for such a plan to be effective, they need to assess what needs are not being met and to structure a program based on a budget that would pay for in-home care of the neediest cases over the next five to seven years.
 Among the most acute cases are those who suffer from a loss of memory compounded by the emotional triggers that affect many victims.
 As their memories fail, they often recall their younger lives, when they may have been forced from their homes, crowded into cattle cars and ripped from their parents, whom in most cases they would never see again.
 “When you are a Holocaust survivor and regress, what you are going back to is darkest point of human history,” Mr. Schneider said.
 He gave the example of a woman in the program with dementia who requires full-time care. Although she still lives with her husband, who also survived the Holocaust, every time he tries to leave their home she starts to scream, “Don’t go! They will take you away, they will get you!”
 “She is living in a world where the Nazis are still there,” Mr. Schneider said.
 In response to a congressional letter written to Finance Minister Wolfgang Schäuble in December, Jens Spahn, a deputy minister who is leading the negotiations on behalf of the German government, said his country recognized that current levels of care were “insufficient for those in need of intensive long-term care.”
 “Some survivors require more extensive care, in some cases full-time care,” Mr. Spahn wrote in the letter.
 Germany has made payments worth more than 73.4 billion euros, about $83 billion, in reparations and compensation, mostly to Jewish victims of the Nazis. The assistance to aging survivors is only a small part of these contributions.
 “Many of my constituents are in their 80s, 90s, even 100, and our focus is ensuring that their needs can be provided for,” Mr. Deutch said.
 “I’ve been trying to help survivors since coming to Congress six years ago,” he said. “While we acknowledge that what is being done by the Germans is incredibly generous, survivors’ needs are not being met.”
",
7840,"KABUL, Afghanistan — Women’s sports programs in Afghanistan, long a favorite of Western donors, have all but collapsed.
 Some consist of little more than a young woman with a business card and a desk, as one insider described the women’s version of cricket, Afghanistan’s most popular game. Others, like women’s soccer, have managed to field a few teams for practices and training sessions but have not played an international match in years.
 Even the relatively few encouraging stories, like women’s taekwondo, one of the sports that may see an Afghan woman sent to the 2016 Olympics in Rio de Janeiro, are at best qualified successes. Afghanistan’s strongest hope for a female taekwondo medalist, Somaya Ghulami, 23, actually lives in Iran and commutes to practice sessions here. She said she would never be able to compete if she had to live in her own country.
 It is a conspicuous failure for Western efforts to improve the lives of Afghan women. With few exceptions, the sports programs have become riddled with corruption and been undermined by conservative Afghans who have never liked the idea of young women on sports fields.
 One of the main supporters of women’s sports in Afghanistan is the American government, which spends $1.5 million a year on coeducational sports programs — not counting a $450,000 cricket grant that officials took back when they realized no women’s cricket was being played. American officials, however, declined to discuss women’s sports on the record.
 While all women’s sports here are suffering, none have failed quite as spectacularly as the women’s national cycling team. Celebrated in documentaries, and the subject of a 2014 book and a blizzard of news articles, the team was recently nominated for this year’s Nobel Peace Prize — thanks to the tireless promotion of its benefactor, Shannon Galpin, who financed the team through her Colorado-based charity, Mountain to Mountain.
 However, Ms. Galpin announced on her web page last month that she would no longer support the Afghan Cycling Federation because of what she described as “out of control” corruption by the team’s longtime coach and the head of the federation, Haji Abdul Sediq Seddiqi.
 Ms. Galpin was upset that sponsors’ gifts, including more than 40 bicycles and other racing gear, valued at more than $100,000, were stolen after being handed over by her organization to the team and Mr. Seddiqi.
 Mr. Seddiqi was recently dismissed from his post as both coach and head of the federation by the president of the Afghanistan National Olympic Committee, Mohammad Zaher Aghbar, who cited something besides corruption. He claimed that Mr. Seddiqi had successively married and divorced three of the young women on his team. “He has married three of them — three times — and the girls were all complaining about him,” Mr. Aghbar said.
 In an interview, Mr. Seddiqi denied the corruption charges, claimed Ms. Galpin’s organization was still financing the cycling federation and called the accusations against him “a lot of made-up crap.” Mr. Seddiqi, 62, acknowledged that he had three prior divorces and was now married to a 25-year-old woman, but denied that his current or past wives were ever team members.
 One national cycling champion (Mr. Seddiqi also controlled the men’s team), Hashmat Barakzai, who recently fled to Germany to claim asylum, said that “Seddiqi used the women’s team as his personal piggy bank and love playground.”
 Mr. Seddiqi’s critics said training was almost nonexistent. “He would take them out to a roundabout on the highway and ride around in circles,” Ms. Galpin said.
 “Under coach,” Ms. Galpin said, referring to Mr. Seddiqi, “it’s zero female empowerment.”
 Corruption in other women’s sports might not be quite as brazen, but it remains a huge problem. Diana Barakzai, who played for Afghanistan’s women’s cricket team when it was actually functioning, in 2009, said she was approached recently by the Afghanistan Cricket Board about heading up a women’s team.
 “They told me they already made a deal with someone to pay them $180,000 for the job, but if you’re willing to pay $200,000 you can have it,” she said, adding that she turned the offer down.
 Ms. Barakzai, who is not related to Mr. Barakzai, said she was surprised by the demand, since she assumed there was no money to be made in women’s cricket. Besides, the national team had not competed — or even practiced — in at least three years.
 But it turned out that the United States Embassy had awarded a grant of $450,000 last summer to promote women’s cricket and had sent it to Lapis Communications, a private organization, to administer. Those funds have now been returned to the American Embassy, said a Lapis official, Sarah-Jean Cunningham. “This program did not get the traction it needed to justify pushing forward,” she said.
 Shafiq Stanikzai, the chief executive officer of the Afghanistan Cricket Board, denied Ms. Barakzai’s accusations. “That’s totally a false claim that she made and a very stupid one,” he said.
 Mr. Stanikzai said that there was a national women’s cricket program but that it was operating in secret. “We are not publicizing that due to certain limitations,” he said. “The national team is functioning but at a very basic level, as they are not good enough to compete at an international level.”
 But Peter Anderson, an Australian cricket coach who was brought to Afghanistan several years ago to train its women’s cricket team, said the cricket board was so against women participating that it had dismantled what women’s team there was. He said he quit after being shunted to coaching the disabled team.
 Tuba Sangar is the current head of women’s cricket — the person Mr. Anderson described as “a girl in an office with a business card.” When contacted, she said she was not allowed to comment.
 Robina Jalali was on the first women’s team to compete in 2004 in the Olympics for Afghanistan after the Taliban were toppled. A runner, she was one of two at the 2004 Games. Now the head of women’s sports at the National Olympic Committee, she says that even the foreign embassies are no longer paying much attention.
 “The main problem is the growing insecurity we have; secondly, violence against women, which is growing. Women are not feeling safe to train,” she said. “Now we see the youth are just running away from the country, which has changed the mentality of the embassies,” she continued. “They feel they can’t give a girl a visa to compete because she’s not going to come back.”
 But the women’s soccer team, often held up as an example of success, has not played internationally since 2014. There are plans to do so sometime this year, yet neither the date nor the country where it will take place has been set, said Khatool Shahzad, an official with the soccer federation.
 Shamila Kohestani is a women’s soccer success story, going from captain of the women’s team in 2007 to a scholarship at Drew University in New Jersey. Her dream had been to return here as a coach, but after a recent visit to Kabul she decided not to.
 Ms. Kohestani thinks that Afghan officials never really supported the idea of women in sports, saying they only feigned interest because women’s sports were such grant magnets. “They would say, ‘I would never let my daughter do that,’” she said. “They treated us like sluts or something because we’re running around showing ourselves to men.”
 The women’s soccer team still exists, mainly because the players are encouraged to participate by what for Afghanistan are generous cash payments: $100 a month for national team members and $50 for junior team members.
 Despite that incentive, only 10 national team members out of 22 (the women play 11-a-side soccer) came out for a recent two-hour practice; their coach, a man, did not show up at all.
 The team captain, Forozan Tajali, 22, took over the training session. She said security concerns, family pressure and public harassment were not the only difficulties the soccer players faced. The national team has lost more members to marriage than anything else, she said, because Afghan women are considered too old to wed after their early 20s, and their husbands typically refuse to allow them to play.
 Taekwondo has been similarly hurt, Ms. Ghulami said during a recent training session here, adding, “Fortunately, I have a liberal family that does support me — and we live in Iran.”
",
6097,"With Donald Trump’s unfavorable ratings at record levels, the Republican Party’s prospects for taking back the White House already seem bleak. But its chances may be even worse yet. The doubts Mr. Trump has raised during his primary campaign also undermine the strongest rationale for any Republican candidate in this election: the need for new leadership after eight years of Democratic control of the White House.
 The Emory University political scientist Alan Abramowitz highlights this factor in his “time for a change” forecasting model of presidential election outcomes. “When a party has held the White House for two or more terms,” he writes, “voters will be more likely to feel that it is time to give the opposing party an opportunity to govern than when a party has held the White House for only one term.”
 Mr. Abramowitz finds that the party in power performs approximately five percentage points worse in the popular vote after two or more terms in office in a model that controls for the current president’s approval rating and the state of the economy. The sample size of post-World War II elections is very small, but Mr. Abramowitz’s model dominates the field in its forecasting accuracy.
 Both Mr. Abramowitz’s model and a similar one from the political scientists John Sides, Michael Tesler and Lynn Vavreck (an Upshot contributor) would characterize Republicans as the favorite in this election with an estimated probability of winning of approximately 60 percent. As Mr. Sides notes, the G.O.P. edge is due in large part “to the White House’s greater tendency to change hands the longer the incumbent party has been there.”
 But these forecasts are made based on simple models that do not include any information about the nominees (and implicitly assume, as Mr. Abramowitz notes, that the parties select mainstream candidates). In contrast, betting and prediction markets that take the likely party nominees into account put Mr. Trump’s chances of winning in November at approximately 25 percent.
 Why, then, is Mr. Trump looking so likely to underperform in November? Even his unfavorability ratings may not fully explain his diminished chances. Candidates who are initially not seen as personally likable can overcome those perceptions, as Bill Clinton did in 1992, another “time for a change” election (though Mr. Trump’s ratings are worse, and he has been known for longer at the national level).
 For instance, consider a counterfactual situation in which Ted Cruz, Mr. Trump’s chief rival, became the nominee. Mr. Cruz also had high unfavorable numbers before dropping out of the race, but if he had won the G.O.P. nomination under normal circumstances, most Republicans would have probably rallied around him (as they did around Mitt Romney in 2012), and the electorate would have eventually come to see him somewhat less negatively.
 In Mr. Trump’s case, his reputation for irresponsibility and lack of political experience overshadow the “time for a change” message. He frequently calls for new leadership — a message that would normally be the strongest G.O.P. appeal in an election year when the economy is not weak enough to be the focus of the opposition’s campaign. But instead of being a referendum on the incumbent party’s failures, this election seems likely to turn on how voters view Mr. Trump himself. Many voters who might have been open to an alternative after eight years of President Obama will instead ponder whether it is too risky to vote for Mr. Trump, especially after Mrs. Clinton makes his qualifications the central message of her campaign.
 Mr. Trump could still win, but he will have to find some way to turn the focus back to Mrs. Clinton and the Democrats and to convince voters that the change in leadership he represents is desirable.
",
3173,"CULVER CITY, Calif. — A day after offering a forceful denunciation of Donald J. Trump, Hillary Clinton on Friday expressed hope that she was only days away from putting the long-running Democratic nominating fight behind her.
 “If all goes well, I will have the great honor as of Tuesday to be the Democratic nominee for president,” she said at a rally featuring a lengthy lineup of well-known actresses, including Sally Field, Debra Messing, Elizabeth Banks, Sophia Bush and Mary Steenburgen.
 Mrs. Clinton is expected to secure enough delegates on Tuesday to become the party’s presumptive nominee, probably before the polls close in California, one of the six states with nominating contests that day.
 The moment cannot come soon enough for Mrs. Clinton, who has already turned her attention to Mr. Trump, the presumptive Republican nominee, attacking him on a variety of subjects at campaign events, while almost never mentioning her remaining Democratic rival, Senator Bernie Sanders of Vermont.
 But Mr. Sanders has proved to be a formidable opponent in California, and the primary here Tuesday is expected to be close, even if its importance is symbolic, given Mrs. Clinton’s wide lead in delegates.
 In her final campaign swing in California before the primary, Mrs. Clinton turned on Friday to some celebrities to give her a boost.
 In a gym at West Los Angeles College, the D.J. Samantha Ronson handled the music, and a procession of actresses spoke in support of Mrs. Clinton and skewered Mr. Trump.
 “He ran a university, it no longer exists,” Ms. Banks said. “He had a TV show, it no longer exists. He had hair. …” She let those words linger, and the crowd laughed.
 Ms. Messing warned that if Mr. Trump became president, “We will be a country led by a reckless bigot and misogynist.” Ms. Bush said Mr. Trump wanted “to make our country a fearful reality show contest.”
 And Ms. Field questioned why Mrs. Clinton had been criticized as unlikable, asking, “What is this, a high school popularity contest?” She said that Mrs. Clinton was “not running to be everybody’s friend.”
 “Women have spent the last hundred years trying to get out from under the expectation that they had to be sugar and spice and everything nice,” Ms. Field said. “We don’t need sugar and spice and everything nice.”
 Mrs. Clinton did not use up all her available star power at Friday’s event. The actress Jamie Lee Curtis joined her at a rally in California last week, and the singer Jon Bon Jovi spoke at a rally on Wednesday in New Jersey, which also votes next week.
 And in Los Angeles on Monday, she will hold a fund-raising concert featuring Christina Aguilera, Andra Day, John Legend, Ricky Martin and Stevie Wonder.
 At the rally on Friday, Mrs. Clinton brought up her speech the day before, in which she declared that Mr. Trump was unfit to be commander in chief and said that electing him would be a “historic mistake.”
 Mr. Trump later wrote on Twitter that Mrs. Clinton “made up things” in her speech. But Mrs. Clinton told the crowd on Friday that she simply repeated “what Donald Trump has said.”
 “I didn’t make any of that up,” she said. “I mean, it would be hard to make up. And by the end of working on that speech, even I was saying, ‘Did he really say all of this?’ Well, indeed he did.”
",
